{
  "site": {
    "metadata": {
      "title": "Quang Cuong Huynh | Information Systems Architect & DevSecOps Specialist",
      "author": "Quang Cuong Huynh",
      "description": "Professional portfolio of Quang Cuong Huynh — Information Systems Architect specializing in Cloud & DevOps, QA & Compliance, and Enterprise Security. Showcasing expertise in scalable architectures, automation, and digital transformation across multi-cloud environments.",
      "keywords": [
        "Information Systems Architect",
        "Cloud Architecture",
        "DevSecOps",
        "Django Full Stack",
        "Azure CAF",
        "Security Compliance",
        "Enterprise Automation"
      ],
      "language": "en",
      "theme": "light",
      "version": "1.0.0"
    },
    "social": {
      "github": "https://github.com/quangcuong-huynh",
      "linkedin": "https://linkedin.com/in/quangcuong-huynh",
      "twitter": null,
      "email": "contact@quangcuong.dev",
      "website": "https://quangcuong.dev"
    },
    "navigation": [
      {
        "label": "Home",
        "path": "/",
        "icon": "fas fa-home"
      },
      {
        "label": "About",
        "path": "/about",
        "icon": "fas fa-user"
      },
      {
        "label": "Skills",
        "path": "/skills",
        "icon": "fas fa-code"
      },
      {
        "label": "Experience",
        "path": "/experience",
        "icon": "fas fa-briefcase"
      },
      {
        "label": "Projects",
        "path": "/projects",
        "icon": "fas fa-folder-open"
      },
      {
        "label": "Certifications",
        "path": "/certifications",
        "icon": "fas fa-certificate"
      },
      {
        "label": "Blog",
        "path": "/blog",
        "icon": "fas fa-blog"
      },
      {
        "label": "Contact",
        "path": "/contact",
        "icon": "fas fa-envelope"
      }
    ]
  },
  "profiles": [
    {
      "id": "profile-001",
      "name": "Quang Cuong Huynh",
      "job_title": "Information Systems Architect | Cloud & DevOps | QA & Compliance",
      "bio": "As an Information Systems Architect, Quang Cuong Huynh designs scalable, secure, and compliant cloud infrastructures that align with enterprise goals. With a foundation in DevSecOps and digital transformation, he focuses on bridging development, operations, and governance to build future-ready systems. His experience spans Azure CAF, container orchestration, and multi-cloud automation frameworks.",
      "summary": "Architecting reliable cloud systems with DevSecOps and compliance-by-design.",
      "location": "Ho Chi Minh City, Vietnam",
      "avatar": "/assets/images/avatar.jpg",
      "resume_pdf": "/assets/resume_quangcuong_architect.pdf",
      "created_at": "2025-01-01T00:00:00Z",
      "updated_at": "2025-10-16T00:00:00Z"
    },
    {
      "id": "profile-002",
      "name": "Quang Cuong Huynh",
      "job_title": "Security Architect | Governance, Risk & Compliance (GRC)",
      "bio": "Quang Cuong Huynh leads cybersecurity and compliance architecture for cloud and hybrid systems. Combining DevSecOps, threat modeling, and regulatory alignment, he ensures organizations achieve resilient infrastructure that meets ISO, NIST, and CIS standards. His work integrates automation with security frameworks to maintain visibility and trust at scale.",
      "summary": "Securing enterprise systems through automation and risk-driven design.",
      "location": "Ho Chi Minh City, Vietnam",
      "avatar": "/assets/images/avatar.jpg",
      "resume_pdf": "/assets/resume_quangcuong_security.pdf",
      "created_at": "2025-01-01T00:00:00Z",
      "updated_at": "2025-10-16T00:00:00Z"
    },
    {
      "id": "profile-003",
      "name": "Quang Cuong Huynh",
      "job_title": "Full-Stack Developer | Python & Django Engineer",
      "bio": "A results-driven software engineer specializing in Python, Django, and modern web architecture. Quang builds performant, maintainable systems following TDD/BDD principles and scalable design patterns. He focuses on integrating secure backend APIs with clean, responsive frontends using React and soft-minimalist UI principles.",
      "summary": "Building secure, elegant full-stack web applications from architecture to delivery.",
      "location": "Ho Chi Minh City, Vietnam",
      "avatar": "/assets/images/avatar.jpg",
      "resume_pdf": "/assets/resume_quangcuong_fullstack.pdf",
      "created_at": "2025-01-01T00:00:00Z",
      "updated_at": "2025-10-16T00:00:00Z"
    },
    {
      "id": "profile-004",
      "name": "Quang Cuong Huynh",
      "job_title": "Data & Automation Engineer | Cloud Analytics",
      "bio": "Blending system architecture with data engineering, Quang Cuong Huynh designs automated data pipelines and observability platforms across multi-cloud environments. He uses Python, SQL, and containerized workflows to optimize analytics, logging, and reporting pipelines for enterprise operations and performance visibility.",
      "summary": "Automating data and insight delivery through scalable cloud pipelines.",
      "location": "Ho Chi Minh City, Vietnam",
      "avatar": "/assets/images/avatar.jpg",
      "resume_pdf": "/assets/resume_quangcuong_data.pdf",
      "created_at": "2025-01-01T00:00:00Z",
      "updated_at": "2025-10-16T00:00:00Z"
    },
    {
      "id": "profile-005",
      "name": "Quang Cuong Huynh",
      "job_title": "QA & Reliability Engineer | DevOps Test Automation",
      "bio": "Quang Cuong Huynh specializes in ensuring software reliability through continuous testing and automation. His work integrates CI/CD, containerized test environments, and behavior-driven frameworks. He focuses on system observability, fault injection, and zero-downtime deployment validation to maintain enterprise-grade reliability.",
      "summary": "Engineering reliability and quality automation into every deployment cycle.",
      "location": "Ho Chi Minh City, Vietnam",
      "avatar": "/assets/images/avatar.jpg",
      "resume_pdf": "/assets/resume_quangcuong_qa.pdf",
      "created_at": "2025-01-01T00:00:00Z",
      "updated_at": "2025-10-16T00:00:00Z"
    },
    {
      "id": "profile-006",
      "name": "Quang Cuong Huynh",
      "job_title": "Information Systems Architect | Storyteller of Systems and Human Insight",
      "bio": "Across his career, Quang Cuong Huynh has walked the fine line between code and consciousness — from architecting enterprise clouds to understanding how systems shape human experience. Trained in cloud architecture, DevSecOps, and quality assurance, he approaches technology not merely as a collection of tools, but as an evolving ecosystem where resilience, logic, and empathy intertwine.\n\nQuang sees design patterns as philosophies — blueprints of understanding that mirror human thinking. Whether he’s building scalable platforms, integrating compliance frameworks, or leading digital transformation, his purpose remains constant: to create systems that are transparent, trustworthy, and humane.\n\nIn his view, the future of technology belongs not just to those who automate, but to those who comprehend — those who can craft systems that reflect human clarity amid algorithmic noise.",
      "summary": "Blending architecture, philosophy, and clarity to build systems that serve both logic and humanity.",
      "location": "Ho Chi Minh City, Vietnam",
      "avatar": "/assets/images/avatar_story.jpg",
      "resume_pdf": "/assets/resume_quangcuong_story.pdf",
      "created_at": "2025-01-01T00:00:00Z",
      "updated_at": "2025-10-16T00:00:00Z"
    }
  ],
  "skills": [
    {
      "id": "skill-001",
      "area": "Cloud & DevOps",
      "name": "Cloud Architecture & Infrastructure as Code",
      "skills": [
        "Azure (CAF, Bicep, ARM Templates)",
        "AWS (EC2, Lambda, CloudFormation)",
        "Google Cloud Platform (GKE, Cloud Run)",
        "Terraform & Terragrunt",
        "Kubernetes, Docker, OpenShift"
      ],
      "sfia_level": "L5",
      "industry_level": "Lead Architect",
      "proficiency": "expert",
      "sector": "Enterprise & Public Cloud",
      "description": "Designs and governs enterprise-grade multi-cloud architectures with IaC-first principles. Implements Azure CAF Blueprints and CIS/NIST-aligned topologies for security, scalability, and compliance. Champions GitOps and automation pipelines for consistent cloud provisioning and policy-as-code governance.",
      "years_experience": 7,
      "last_used": "2025",
      "evidence": [
        {
          "type": "certification",
          "title": "AWS Certified Solutions Architect – Professional",
          "url": "/certifications/aws-sap",
          "date": "2025-03-15"
        },
        {
          "type": "project",
          "title": "Enterprise ZTA Cloud Foundation (Azure CAF)",
          "url": "/projects/azure-zta",
          "date": "2024-09-01"
        }
      ],
      "tags": [
        "cloud",
        "devops",
        "terraform",
        "azure",
        "aws",
        "kubernetes"
      ],
      "featured": true,
      "order": 1
    },
    {
      "id": "skill-002",
      "area": "Security & Compliance",
      "name": "Zero Trust Architecture & Governance",
      "skills": [
        "Azure ZTA & Policy Frameworks",
        "Identity & Access Management (IAM)",
        "Security Information & Event Management (SIEM)",
        "Threat Modeling & Risk Analysis",
        "NIST, CIS, ISO27001 Compliance"
      ],
      "sfia_level": "L5",
      "industry_level": "Principal Architect",
      "proficiency": "advanced",
      "sector": "Security & Risk Management",
      "description": "Implements Zero Trust cloud architectures integrating identity, network segmentation, and data governance. Aligns enterprise infrastructure with NIST and CIS standards. Designs compliance automation and security-as-code frameworks that maintain resilience and transparency across development lifecycles.",
      "years_experience": 6,